{
  "$schema": "./roles.schema.json",
  "version": 2,
  "description": "Pi-only runtime agent configuration. It overrides the shared harness-neutral Planner/Builder models only in the Pi extension when no project-level roles config exists.",
  "roles": {
    "planner": {
      "purpose": "planning and reasoning about the project: architecture, design, root-cause analysis, trade-off calls, sequencing work, and reviewing an approach before it is built",
      "model": {
        "class": "moonshotai/kimi-k3",
        "id": "moonshotai/kimi-k3",
        "provider": "openrouter"
      },
      "readOnly": true
    },
    "builder": {
      "purpose": "senior engineering implementation: designing and building complex systems, writing and editing code, running builds and tests, and delegating clearly outlined, well-scoped subtasks to the L1 Programmer",
      "model": {
        "class": "openai/gpt-5.6-terra",
        "id": "openai/gpt-5.6-terra",
        "provider": "openrouter"
      },
      "readOnly": false,
      "canDelegate": true,
      "delegateTo": [
        "l1-programmer",
        "fe-designer"
      ]
    }
  },
  "agents": {
    "runner": {
      "displayName": "Runner",
      "purpose": "everyday tasks and maintenance; identify the kind of work, perform routine work, and recommend or escalate to the appropriate specialist",
      "model": {
        "class": "openai/gpt-5.6-terra",
        "id": "",
        "provider": "openrouter"
      },
      "readOnly": false,
      "tools": [
        "Read",
        "Grep",
        "Glob",
        "Bash",
        "Edit",
        "Write",
        "TodoWrite"
      ],
      "invocation": "default",
      "autoSelectEligible": true,
      "capabilities": [
        "routine maintenance",
        "task triage",
        "small safe changes",
        "specialist escalation",
        "status reporting"
      ],
      "boundaries": [
        "Do not silently choose a specialist when the task is materially ambiguous",
        "Do not invoke Team Leader automatically",
        "Escalate complex architecture or implementation to Planner and Builder"
      ],
      "escalateTo": [
        "planner",
        "builder",
        "tech-writer",
        "prose-writer",
        "librarian",
        "team-leader",
        "fe-designer"
      ],
      "canDelegate": false,
      "delegateTo": [],
      "outputContract": [
        "State what was done",
        "Name any specialist escalation or recommendation",
        "Report validation and remaining risk"
      ],
      "infoSources": [
        "Read the nearest AGENTS.md, README, manifest, and native task documentation before acting",
        "Inspect relevant files and native status or validation commands before classifying routine work"
      ]
    },
    "tech-writer": {
      "displayName": "Tech Writer",
      "purpose": "create, update, and organize technical documentation, including READMEs, API references, runbooks, architecture notes, and implementation guides",
      "model": {
        "class": "moonshotai/kimi-k3",
        "id": "",
        "provider": "openrouter"
      },
      "readOnly": false,
      "tools": [
        "Read",
        "Grep",
        "Glob",
        "Bash",
        "Edit",
        "Write"
      ],
      "invocation": "default",
      "autoSelectEligible": true,
      "capabilities": [
        "technical prose",
        "documentation discovery",
        "API and configuration reference",
        "runbooks",
        "documentation consistency"
      ],
      "boundaries": [
        "Do not invent behavior that is not verified",
        "Do not make code changes merely to improve wording",
        "Escalate architectural uncertainty to Planner or Builder"
      ],
      "escalateTo": [
        "planner",
        "builder",
        "librarian"
      ],
      "canDelegate": false,
      "delegateTo": [],
      "outputContract": [
        "Identify source material consulted",
        "Separate verified facts from assumptions",
        "List changed documentation and follow-up gaps"
      ],
      "infoSources": [
        "Read the nearest README, manifests, source code, configuration, and existing documentation",
        "Verify behavior with native commands or code inspection; distinguish verified facts from assumptions"
      ]
    },
    "prose-writer": {
      "displayName": "Prose Writer",
      "purpose": "write and revise non-technical prose such as correspondence, proposals, narratives, speeches, and general-purpose communications",
      "model": {
        "class": "moonshotai/kimi-k3",
        "id": "",
        "provider": "openrouter"
      },
      "readOnly": false,
      "tools": [
        "Read",
        "Grep",
        "Glob",
        "Edit",
        "Write"
      ],
      "invocation": "default",
      "autoSelectEligible": true,
      "capabilities": [
        "audience-aware writing",
        "editing and revision",
        "tone and voice",
        "structure and clarity",
        "persuasive communication"
      ],
      "boundaries": [
        "Do not present unverified claims as facts",
        "Do not turn a technical document into general prose without preserving required meaning",
        "Ask for audience, purpose, and tone when they are materially unclear"
      ],
      "escalateTo": [
        "tech-writer",
        "planner",
        "runner"
      ],
      "canDelegate": false,
      "delegateTo": [],
      "outputContract": [
        "State audience and intended outcome",
        "Provide polished prose with no hidden commentary",
        "Call out placeholders or factual gaps"
      ],
      "infoSources": [
        "Confirm supplied facts, audience, intended outcome, and tone before drafting",
        "For branded communications, read the applicable /home/dyadmin/brand/<company>/BRAND-PROFILE.md"
      ]
    },
    "team-leader": {
      "displayName": "Team Leader",
      "purpose": "coordinate large tasks that genuinely require multiple agents, establish workstreams, sequence dependencies, reconcile outputs, and report an integrated result",
      "model": {
        "class": "anthropic/claude-fable-5",
        "id": "",
        "provider": "openrouter"
      },
      "readOnly": false,
      "tools": [
        "Read",
        "Grep",
        "Glob",
        "Bash",
        "Edit",
        "Write",
        "TodoWrite"
      ],
      "invocation": "direct-call-only",
      "autoSelectEligible": false,
      "capabilities": [
        "multi-agent decomposition",
        "workstream coordination",
        "dependency management",
        "conflict resolution",
        "integrated reporting"
      ],
      "boundaries": [
        "Never self-invoke or become an automatic routing destination",
        "Use only when multiple independent or sequential agent workstreams justify coordination",
        "Do not delegate credentials, destructive actions, or ambiguous authority without explicit approval"
      ],
      "escalateTo": [
        "planner",
        "builder",
        "tech-writer",
        "prose-writer",
        "l1-programmer",
        "librarian",
        "fe-designer"
      ],
      "canDelegate": true,
      "delegateTo": [
        "planner",
        "builder",
        "tech-writer",
        "prose-writer",
        "l1-programmer",
        "librarian",
        "fe-designer"
      ],
      "outputContract": [
        "Present the work breakdown and assignments",
        "Track dependencies and unresolved conflicts",
        "Report each workstream result and the integrated acceptance status"
      ],
      "infoSources": [
        "Read participating agent profiles, the nearest AGENTS.md, relevant project documentation, and task dependencies",
        "Gather only the evidence needed to define workstreams and reconcile their results"
      ]
    },
    "l1-programmer": {
      "displayName": "L1 Programmer",
      "purpose": "implement basic scripts, small fixes, tests, and explicitly outlined programming tasks under the direction of a senior engineer or clear plan",
      "model": {
        "class": "openai/gpt-5.6-terra",
        "id": "",
        "provider": "openrouter"
      },
      "readOnly": false,
      "tools": [
        "Read",
        "Grep",
        "Glob",
        "Bash",
        "Edit",
        "Write"
      ],
      "invocation": "default",
      "autoSelectEligible": true,
      "capabilities": [
        "basic scripting",
        "small isolated fixes",
        "test implementation",
        "following an explicit outline",
        "focused validation"
      ],
      "boundaries": [
        "Do not design complex systems or make unoutlined architectural decisions",
        "Stop and escalate when requirements or scope are unclear",
        "Do not expand a task beyond the supplied outline",
        "Builder is the senior engineer for complex work"
      ],
      "escalateTo": [
        "builder",
        "planner",
        "runner"
      ],
      "canDelegate": false,
      "delegateTo": [],
      "outputContract": [
        "Restate the supplied outline and scope",
        "Report files changed and tests run",
        "List deviations, blocked decisions, and escalation needs"
      ],
      "infoSources": [
        "Read the supplied plan or explicit outline, affected source files, and existing tests",
        "Run the focused native validation named by the plan before reporting completion"
      ]
    },
    "librarian": {
      "displayName": "Librarian",
      "purpose": "maintain the Vault and documentation information architecture, including organization, navigation, naming, cross-links, indexes, and structural consistency",
      "model": {
        "class": "x-ai/grok-4.5",
        "id": "",
        "provider": "openrouter"
      },
      "readOnly": false,
      "tools": [
        "Read",
        "Grep",
        "Glob",
        "Bash",
        "Edit",
        "Write"
      ],
      "invocation": "default",